{
  "$schema": "https://json-schema.org/draft/2020-12/schema",
  "$id": "https://flex.dev/schemas/status.v1alpha1.schema.json",
  "title": "CP-2 DeploymentStatus v1alpha1",
  "description": "Body of POST /api/v1/devices/{deviceId}/deployments/{dep}/status: one record of the engine's persisted outbox (core/reconciler.py report()). Sent in seq order, re-sent after a cut; the cloud drops seq <= last seen per device (idempotent). Reason texts are registered in reason-codes.v1alpha1.json.",
  "$comment": "Closed object: a new field is an additive change to this schema (v1alpha1). The cloud may add fields when it stores a record (fakecloud: receivedAt, deploymentId, deviceId); those are not part of the request. Rules by state: Installing has version, digest, plan; Pending and Failed have a reason; Removing and Removed have a version.",
  "type": "object",
  "required": ["dep", "seq", "state", "deviceTime", "manifestVersion"],
  "additionalProperties": false,
  "properties": {
    "dep": {"$ref": "desired-state.v1alpha1.schema.json#/$defs/DeploymentId", "description": "Deployment id; equals the {dep} path segment."},
    "seq": {"type": "integer", "minimum": 1, "description": "Per-device monotonic sequence number (persisted)."},
    "state": {"enum": ["Pending", "Installing", "Installed", "Failed", "Removing", "Removed"]},
    "deviceTime": {"type": "number", "description": "Unix seconds on the device when the record was made."},
    "manifestVersion": {"type": ["integer", "null"], "minimum": 0, "description": "manifestVersion of the accepted desired state (null before any was accepted)."},
    "version": {"type": "string", "description": "Release version (revision) the record is about."},
    "digest": {"$ref": "desired-state.v1alpha1.schema.json#/$defs/Digest"},
    "fromVersion": {"type": ["string", "null"], "description": "Installing: version being replaced (null for a first install)."},
    "plan": {"type": "array", "items": {"type": "string"}, "description": "Installing: the driver's human-readable plan steps."},
    "health": {"enum": ["healthy", "unhealthy"]},
    "reason": {"type": "string", "minLength": 1, "description": "Why (registered text, see reason-codes)."},
    "reasonCode": {"type": "string", "pattern": "^FE-[A-Z0-9]+(-[A-Z0-9]+)*-[0-9]{3}$", "description": "Stable code of `reason` from reason-codes.v1alpha1.json (added 2026-10-17, lead decision; absent when the text is not registered)."},
    "operation": {"const": "remove", "description": "Pending: the held operation is a removal."},
    "waitingFor": {"type": "array", "items": {"$ref": "desired-state.v1alpha1.schema.json#/$defs/DeploymentId"}, "description": "Pending, held by x-flex-dependsOn (EV-42): the dependencies not ready yet (FE-GATE-004), or with operation remove the dependents still to be removed first (FE-GATE-005)."},
    "stage": {"const": "preflight", "description": "Failed: the driver's preflight refused the artefact."},
    "keptPrevious": {"type": "boolean", "description": "Failed (artefact rejected): the previous state keeps running."},
    "interfaceHash": {"type": ["string", "null"], "pattern": "^FLEX(01|SYS01)_[0-9a-f]{64}$", "description": "Installed: interface hash from the release descriptor."},
    "applySeconds": {"type": "number", "minimum": 0},
    "healthGateSeconds": {"type": "number", "minimum": 0},
    "failure": {"type": "string", "minLength": 1, "description": "Failed after apply/health gate: the detailed failure (registered text)."},
    "failFast": {"type": "boolean", "description": "The gate ended on a terminal driver failure, not on its timeout."},
    "detectSeconds": {"type": "number", "minimum": 0},
    "totalSeconds": {"type": "number", "minimum": 0},
    "rolledBackTo": {"type": ["string", "null"], "description": "Version rolled back to; null = first install, workload removed."},
    "rollbackHealthy": {"type": "boolean"},
    "restarts": {"type": ["integer", "null"], "minimum": 0, "description": "Restart count from local supervision (null for start-limit-hit)."},
    "faultVisibleAt": {"type": "number", "description": "mcu-module failure_detail: device-side time the fault became visible (unix s)."},
    "faultToHealthySeconds": {"type": "number", "description": "mcu-module failure_detail: fault -> previous version healthy again."},
    "traceparent": {"type": "string", "pattern": "^00-[0-9a-f]{32}-[0-9a-f]{16}-[0-9a-f]{2}$", "description": "CP-8: W3C trace context of the span that produced the record (with FLEX_OTEL=1)."},
    "correlationId": {"type": "string", "pattern": "^[0-9a-f]{32}$", "description": "CP-8: trace id = plan correlation id."}
  },
  "allOf": [
    {"if": {"properties": {"state": {"const": "Installing"}}}, "then": {"required": ["version", "digest", "plan"]}},
    {"if": {"properties": {"state": {"enum": ["Pending", "Failed"]}}}, "then": {"required": ["reason"]}},
    {"if": {"properties": {"state": {"enum": ["Removing", "Removed"]}}}, "then": {"required": ["version"]}},
    {"if": {"required": ["rolledBackTo"]}, "then": {"properties": {"state": {"const": "Failed"}}, "required": ["failure", "failFast", "detectSeconds"]}}
  ]
}
